id,image_feature
5694,indoor red table white striped blanket sitting food laying pair plate dog bag
5695,indoor sitting green cat laying bed luggage black white table suitcase bag blue
5696,text newspaper indoor bottle front sitting black
5697,photo woman black sitting food holding red sign player
5698,dog building brown indoor sitting standing looking laying small large white lying black door
5699,indoor person bed laying dog lying woman blanket sleeping cat room someone man young blurry white holding standing blue
5700,photo monitor wave large table television cat white blue laying
5701,sitting purple lit table light standing holding room white bed computer night blue water man bag
5702,table indoor sitting food book plate wine wooden restaurant phone coffee pizza
5703,person man indoor black wearing white cat close shirt laying suit young head standing mouth sleeping teeth red brushing
5704,person indoor holding hand man wearing small blue pair close shirt black someone phone control remote white
5705,indoor sitting table woman yellow dog holding standing water laptop computer man cat
5706,grass appliance outdoor chair table sitting lawn park bench field old set yard area wooden green black grassy woman computer standing parked suitcase group luggage umbrella man laying
5707,person hand holding indoor food piece close red half man pizza bite plate coffee
5708,table sitting wooden piece book suitcase laying luggage food cat phone
5709,indoor bottle table sitting wine filled book computer holding machine store black wooden purple woman desk sign keyboard food restaurant refrigerator standing bus room
5710,sitting remote black laying clock table holding computer cat phone man white sign standing
5711,electronics computer
5712,sitting blurry light
5713,indoor sitting white small black room light laptop phone computer table man bed
5714,cat standing dark black front sitting white woman table computer screen night man laptop playing room holding water bed laying ball
5715,person indoor holding wearing baseball sitting red table young woman girl player man bat shirt ball laying white standing large plate room game people playing
5716,indoor man bed sitting white laying standing refrigerator computer red remote laptop room table television holding bedroom video cat
5717,person man looking woman sitting holding wearing close glasses food red table shirt white
5718,indoor sitting white table room black standing kitchen covered food dirty sink bed
5719,indoor bed sitting laying sleeping laptop white cat
5720,person indoor table hand food sitting holding close using woman someone red bite man fruit cutting eating phone sandwich plate people white
5721,grass outdoor road sitting side street small path parked standing green yellow sign white red grassy field board bus man motorcycle hill hydrant double
5722,person indoor man holding sitting small front hand standing cat white young table room large remote phone stuffed playing
5723,dark standing sitting door man room white front lit laptop large black dog computer screen woman holding table light phone walking street night bed people riding cat laying tall
5724,text indoor
5725,
5726,person indoor man standing front woman sitting table holding mirror young white room
5727,indoor sitting book laying table small pair phone bed shirt holding man cat
5728,blue bed indoor blanket sitting purple shirt wearing man laying table close white young standing red cat
5729,indoor sitting small white mirror table sink counter room man refrigerator standing shower
5730,light computer night monitor laptop sitting lit dark desk sky bright large table white screen room air standing star man keyboard blue flying
5731,table bottle indoor sitting food beer wine laptop desk computer yellow glass wooden counter orange pizza phone sandwich laying water kitchen room people
5732,person indoor refrigerator man holding sitting box small young woman standing black playing kitchen table white remote bed video cat wii game laying room
5733,person indoor sitting man table orange food black pizza holding dog cat oven laying
5734,indoor sitting monitor close front table black screen holding white keyboard television player sign man computer red yellow food blurry standing room meter cat
5735,indoor sitting table black computer oven wooden control laying holding mouse cat remote brush playing
5736,indoor cabinet sitting kitchen white counter standing table shower room refrigerator door sink mirror stove man
5737,man cat wearing standing white holding room bag shirt
5738,indoor dog black sitting brown table small bag laying eating shoes wooden sleeping yellow blue cat white standing water plate stuffed
5739,screen monitor sitting table room phone remote
5740,dog indoor frisbee mouth grass orange looking red brown playing laying blurry white standing holding yellow ball large teeth head cat
5741,indoor table bottle sitting birthday cake food lit sign old water holding
5742,indoor television living room sitting front screen watching table man standing monitor small set flat computer large center holding video playing white cat
5743,sitting bed small table wearing blanket laptop man laying holding woman white sleeping standing cat
5744,table indoor desk sitting computer wooden cup keyboard coffee mouse laptop small food plate bowl kitchen counter white room cake sink desktop oven laying
5745,indoor cat clothing white man black standing sitting wearing shoes suit shower laying closed shirt bed mirror sleeping room
5746,person indoor food front man sitting holding young hand television mirror video teeth woman table playing laying standing brushing remote red room brush cat blurry bed phone
5747,person indoor text man newspaper sitting table photo posing holding people smiling woman young standing room group playing sign living remote video wii game
5748,indoor table ceiling sitting room food bedroom standing man woman desk bed large kitchen holding computer mirror living plate phone blue people white
5749,keyboard sitting computer indoor electronics mouse white black surface desk table close light front book brown laptop old wooden
5750,indoor person bottle table holding food sitting bowl small orange close glass wooden kitchen coffee mug man standing
5751,indoor bed bedding clothing laying sleeping blanket dog small covered brown lying cat white shirt
5752,thing indoor piece table sitting red food suitcase plate cake luggage laying old white sign phone
5753,object thing light
5754,monitor screen black television computer sitting dark table laptop desk light cat standing room phone
5755,indoor person man young small playing front child boy sitting girl table holding cat woman little standing television dog room yellow living bear blue stuffed laying
5756,text
5757,indoor sitting colorful book small child orange laptop table bed open laying blanket baby phone holding green computer room cat
5758,person sitting man window holding woman young playing video remote phone game people standing blue white cat room
5759,indoor window room small sitting mirror white table living standing kitchen door bedroom television cat bed man holding woman sink playing refrigerator blue video
5760,keyboard electronics indoor photo looking black clock close different sitting room white
5761,person indoor sitting looking standing front laying man food young cat boy shoes holding table kitchen playing dog phone white
5762,table cup sitting indoor bottle glass wooden food computer water banana desk coffee oranges cutting sandwich phone
5763,person indoor small holding sitting close table phone red face woman food black wearing hat donut little plate girl white eating shirt cat
5764,table cup sitting indoor food can glass small fruit coffee
5765,
5766,sitting food table donut cake laying sign coffee
5767,indoor white sitting window door room small bed black floor table desk computer water woman man bedroom sink sign standing
5768,sitting door white open box black food cat laying
5769,indoor sitting food kitchen counter table oven microwave stove filled black cooking small wooden pizza computer red pan bowl coffee plate laying
5770,cup table indoor food coffee bottle sitting glass small tray banana close sandwich orange half fruit counter donut plate phone keyboard computer cake water kitchen oranges
5771,blue toy small little child sitting plastic food yellow table orange birthday boy stuffed girl young bear man ball bed holding playing motorcycle player train riding plate cat laying
5772,indoor sitting microwave refrigerator food table kitchen white room oven laying cat
5773,sitting blue shower white standing large tub rug cat room
5774,indoor person clothing bed sitting diaper holding laying table small hand white baby brown man remote woman sleeping cat
5775,text
5776,indoor sitting book bed laying open table old lying covered cat suitcase man white blue stuffed
5777,sitting cat large table man room green black standing computer white desk bed air
5778,
5779,bottle indoor table food sitting can front computer close blue black beer sandwich keyboard standing desk pizza dog hotdog phone kitchen man
5780,outdoor building man sign side large orange restaurant street holding riding city parked yellow court woman parking standing graffiti white ball people
5781,cup indoor table sitting coffee bottle food doughnut glass small wooden donut fruit hot laying phone
5782,indoor sitting monitor screen table computer desk large
5783,bottle indoor table food toothbrush sitting water hand man counter close sink mirror wine holding brush kitchen pizza white glass plate
5784,indoor sitting black small food bowl counter table spoon close glass white red computer plate kitchen
5785,monitor screen indoor television dark sitting table clock large lit computer black light room player blue phone
5786,mirror sitting food
5787,text
5788,indoor bottle toothbrush sitting table small brush plastic filled orange laying green food bed
5789,indoor sitting white floor water standing food man tub glass table kitchen room people dirty shower pizza sink
5790,plant indoor flower window vase table sitting small white green glass pot dining desk red filled clear holding black yellow wooden room water fruit tree living palm cat blue
5791,clock meter
5792,indoor table holding sitting red desk small hand food phone plastic computer kitchen
5793,indoor person sitting laying bed man woman young holding lying white table baby playing cat room
5794,sitting table computer food white laying mouse keyboard remote group cellphone game man plate
5795,person indoor sitting black laying small holding man hand phone cat bed white remote bag sleeping
5796,person bottle holding hand small food sitting man table wine little empty standing counter glass red phone woman young water kitchen
5797,table indoor sitting wooden room laptop computer desk living game floor video people playing woman standing mouse man white wii
5798,sitting room woman yellow table large man standing holding white night people cat
5799,food table sitting plate fruit pizza restaurant sandwich white
5800,grass dog frisbee outdoor mouth brown toy carrying animal holding lawn playing small red cute yard standing large field green white air yellow laying
5801,meter monitor black train
5802,indoor person holding man hand kitchen close food using table white cutting woman yellow laying standing
5803,indoor sitting table computer book desk keyboard mouse laying
5804,person cake cellphone man sitting suit phone holding wearing black young sign shirt white
5805,indoor sitting leather black shoes brown seat close table pair saddle white red standing cat
5806,sitting white laptop table computer dark large black fireworks holding standing red night man room flying
5807,light sitting table lit dark white night red room
5808,sitting monitor table black computer
5809,indoor person cat table man cutting small wooden sitting board holding water standing young can bottle laying food white
5810,indoor table living laptop room sitting man computer wooden holding woman standing people cat
5811,clothing indoor person sweater shirt bed laying yellow blue blanket lying man holding phone white
5812,indoor sitting toothbrush white small close food counter holding brush mirror laptop computer blurry sink red man standing refrigerator cat
5813,indoor room building sitting photo view floor door refrigerator white television living mirror computer bed bedroom
5814,bottle indoor table sitting small food phone beer computer water laptop refrigerator glass desk kitchen black wine standing white laying cake man
5815,bottle indoor sitting food table beer water laying lying refrigerator bed bag counter sandwich hot phone covered kitchen white dog sink standing
5816,indoor sitting table small black desk remote counter white kitchen computer phone clock laying mouse blue
5817,bottle sitting table wooden cat laying open food floor white water standing room phone
5818,woman person clothing lady smiling beautiful hair girl wearing posing holding sitting young female red phone hat black white shirt standing blue
5819,text
5820,person indoor man sitting small hand yellow holding wearing ball phone laying black white young woman remote playing player cat
5821,indoor text table sitting counter desk wine computer laying kitchen white
5822,phone
5823,monitor keyboard indoor computer electronics sitting table desk mouse desktop front black screen cat light white
5824,sitting man cat
5825,indoor sitting orange table computer food pair white red old fruit mouse plate
5826,sitting computer keyboard table food holding
5827,floor indoor table desk sitting computer laptop room small living office black keyboard white red video playing standing mouse clock kitchen remote
5828,indoor cabinet refrigerator kitchen white sitting small door sink counter black mirror stove standing red room man
5829,indoor sitting food white laying blurry dog table black cat holding man
5830,indoor sitting small view white seen mirror seat cat mouse table sink airplane man
5831,text
5832,grass green sitting white field man laying fabric black holding standing cat ball bed room
5833,bottle table indoor sitting food cup toothbrush counter donut laying glass coffee brush water pizza sandwich
5834,food plate sitting table cup bowl red filled black holding pizza
5835,person clothing cellphone phone woman red holding girl man lady standing wearing smiling shirt colorful glasses young white
5836,indoor person table sitting food man glass holding glasses cat phone wearing wine woman white blue
5837,indoor sitting table food orange counter pizza plate red hot kitchen yellow laying white
5838,indoor food sitting table phone white laying
5839,food banana filled sitting table counter fruit oranges bowl different apple pile donut bunch close several glass plate holding display white
5840,bottle sitting food table milk plate mug bowl
5841,person indoor holding hand small monitor remote video game black playing white cellphone man mouse
5842,bottle indoor table sitting green small food holding filled little laptop close room colorful computer man water bed train blue white plate
5843,indoor sitting table young small little woman man girl red laptop close room food cat holding blurry computer bed white remote shirt laying
5844,sitting table small piece paper bag food laying plastic pair phone close
5845,man computer laptop light
5846,indoor kitchen table sitting window counter small wooden room wine refrigerator glass living white laying
5847,person indoor sitting table remote holding bed red phone bag standing white video stuffed laying cat luggage man
5848,indoor sitting table black computer laying food cat bear
5849,person clothing cellphone phone young man holding sitting shirt boy little brown hat wearing standing close head mouth bird large white
5850,cup sitting food table counter coffee
5851,table indoor sitting wooden laying pair knife group board man
5852,monitor sitting computer black table screen television player light white ball room
5853,grass fence chair table building sitting small area white fenced bench green net room garden bed field
5854,laptop computer light dark sitting sky night desk lit monitor standing table man screen large air room star street woman bed sign people white player playing
5855,grass outdoor sitting front man green garden cat park large laying street standing bench riding white playing
5856,indoor thing table sitting food plate white glasses yellow wine red cake cutting pizza cat
5857,sitting food table laying bed phone
5858,indoor bottle sitting table food front computer can pizza keyboard laying water white kitchen
5859,indoor bottle table sitting computer food keyboard black cup counter coffee desk laptop white cutting plate kitchen hot mouse wine blender knife hotdog phone sandwich desktop laying refrigerator
5860,person food table sitting holding donut black man eating plate blue laying remote stuffed standing
5861,sitting man holding yellow riding laying
5862,thing sitting red orange sign holding playing table man player swinging clock meter woman ball standing game
5863,indoor sitting room small bed laying young little cat boy laptop playing wearing computer living white black food close stuffed standing man video holding red game remote
5864,food sitting table small fruit plate donut white oranges holding laying display
5865,
5866,cup indoor table coffee food sitting yellow bottle keyboard kitchen blurry honey
5867,indoor curtain sitting red striped white table close man shower shirt
5868,thing sitting sign green clock red white
5869,
5870,thing microwave clock sitting oven monitor white counter kitchen stove meter laying
5871,indoor food table sitting plate holding sandwich pizza bed laying white
5872,indoor sitting red small table room white food living sign kitchen
5873,red wearing orange sitting small bright shirt white dressed table holding standing man room blue
5874,indoor person man sitting bed white cat large laying fabric room dog sleeping shirt people plate standing group
5875,bottle indoor food table sitting small beer wine banana holding counter fruit yellow kitchen pizza sandwich
5876,indoor sitting white small room black sink table tub mirror standing man bed laying shower kitchen
5877,white cat laying food blurry standing man
5878,food indoor table small sitting plate bowl filled green meal sandwich salad plastic sauce close lunch donut fruit fork broccoli holding eating cheese bun pizza fries oranges white
5879,black sitting white dark laptop computer large night standing table man field cat player flying air sign room street riding
5880,table sitting wooden desk food
5881,indoor tub white sitting small water cat sink head man laying mirror shower
5882,text
5883,indoor table wooden sitting monitor sign side clock white
5884,food sitting close front yellow black orange red sign phone white clock
5885,indoor table sitting food desk brown black plate white dog large wooden computer holding standing stuffed bear
5886,food sitting yellow holding playing remote video man table game young colorful room red
5887,indoor table food sitting small banana holding bowl glass plate sandwich laying cat phone white
5888,indoor thing object monitor sitting clock small microwave table white phone counter device mounted remote black old oven control red display
5889,indoor electronics monitor microwave sitting black oven camera small car open close computer silver phone bus laying white train
5890,sitting table
5891,indoor cat looking sitting dog man front wearing black glasses white standing suit holding hat
5892,person indoor holding hand device sitting man small close shirt table red plate white phone ball
5893,table indoor sitting black set holding small screen desk display computer laptop room glass man wooden wine vase sign red laying white standing phone clock
5894,indoor sitting mirror sink public man white small restroom seat stainless room refrigerator standing kitchen
5895,indoor cup bottle sitting table coffee open toothbrush counter front food close laying desk water computer refrigerator brush sink kitchen blender teeth white man
5896,indoor table sitting red bicycle food laying glass phone white
5897,indoor table sitting chair room computer desk filled laptop living man red luggage bed suitcase large woman standing group umbrella kitchen
5898,indoor food green sitting small orange filled yellow book colorful black bed different table white laying
5899,monitor indoor screen sitting television computer laptop dark water table light large watching flat room lit blue black white keyboard man cat red desk flying desktop standing sunset star holding airplane ocean night living playing people
5900,sitting paper small holding sign table white man phone
5901,indoor food sitting filled table plate pizza
5902,table sitting food computer white
5903,indoor sitting black computer desk keyboard laptop table microwave mouse white oven light laying kitchen
5904,text book
5905,fence building door white sitting glass small shower game table tiled standing man room blue holding bird clock group rain
5906,indoor sitting table toothbrush food wooden brush laying black cat phone
5907,person indoor holding hand man video monitor game remote playing front small sitting black mouse someone television cellphone white control mirror wii people standing
5908,indoor yellow sitting bottle table food banana plastic tray black small laying computer phone sandwich
5909,indoor sitting table laying pair white lying wooden close remote desk food cutting brush computer control
5910,person laptop computer sitting man street black board standing holding phone table sign city white people laying
5911,text
5912,blurry
5913,necktie indoor person blur abstract bed white shirt black wearing man sitting dress blue laying
5914,indoor cup sitting coffee table desk small white computer black keyboard mug glass food cat
5915,indoor sitting black table small monitor computer desk wooden counter mouse keyboard remote phone
5916,indoor person food table sitting woman holding laptop computer standing man fruit people sandwich
5917,green indoor bottle sitting refrigerator table small plastic lotion holding microwave clock white brush room laying kitchen
5918,pair riding
5919,person indoor man looking sitting laptop front using cellphone phone holding table computer young hand woman screen people room playing mouse video
5920,indoor food dish bowl filled plate table banana white full sitting pan fruit soup holding
5921,indoor sitting book laying blue man white
5922,text
5923,indoor sitting cat refrigerator small counter table kitchen white standing room microwave laying man water sink
5924,indoor bed sitting laying cat table man blanket lying white sleeping black laptop yellow computer dog holding bedroom standing
5925,indoor bed red pink laying blanket lying sitting hydrant sleeping flower dog covered large white stuffed
5926,indoor sitting table open book desk laptop monitor computer screen display phone
5927,indoor sitting table red small orange sink kitchen holding microwave food room white phone
5928,indoor sitting keyboard remote cat close computer control television blurry laying white
5929,indoor sitting front table monitor large blurry man pan red mirror water standing oven bus white cat
5930,electronics indoor monitor sitting photo table video screen game speaker television different remote computer phone
5931,sitting keyboard computer black large standing
5932,photo small sitting food laying covered
5933,indoor paper food sitting bottle table laying display
5934,indoor sitting table book small phone cat food laptop laying black holding bed bag
5935,indoor sitting table red small food holding room orange phone keyboard white sign brush stacked
5936,computer indoor electronics monitor laptop desk sitting table display keyboard black mouse screen desktop cat television video apple standing white large remote room
5937,person indoor green sitting man close wearing table white black laying pair blue cat standing bag
5938,indoor sitting table book food black small laying brown pair red white knife remote wine bottle phone coffee
5939,
5940,indoor sitting bed white room black bedroom man airplane
5941,thing bicycle sitting table black motorcycle player laying
5942,indoor table sitting food sign red cake phone
5943,bottle indoor table sitting food glass wine laying beer empty black red coffee
5944,text photo sitting table cake woman group large standing bear white man
5945,indoor sitting laying bed small cat lying table white black bear room
5946,indoor bottle person food sitting table holding small hand front can wine baby close kitchen sandwich phone bear refrigerator
5947,indoor looking sitting brown standing yellow room large orange cat table dog living white laying man
5948,bottle sitting table glass blue black food beer water phone
5949,indoor sitting red table small laying white bed room cat
5950,table sitting black phone laying
5951,keyboard electronics computer indoor sitting mouse close laptop light white desk dark black table blurry man
5952,building man sitting floor cat holding white standing black table woman ball playing laying pair court player room
5953,building man holding walking woman rug standing people playing white player
5954,keyboard indoor computer desk table sitting mouse monitor desktop laptop front lamp black light view white screen yellow room cat laying man remote clock
5955,food sitting table plate red close doughnut white fruit covered fork donut cake blurry laying
5956,indoor table person sitting chair brown small desk wooden holding plate man leather room phone bag white baseball standing
5957,remote indoor table sitting control desk laying computer wooden keyboard phone
5958,covered sitting food laying many dog table yellow refrigerator pizza street
5959,person indoor sitting food close red man holding blurry
