id,image_feature
6744,person indoor room living television window standing front looking playing screen holding cat young black video sitting monitor boy man game table wearing woman blue red shirt remote
6745,indoor cabinet sitting table wooden black kitchen computer wine laying stove white plate stuffed man
6746,sitting laying white man glasses table standing pair water cat game
6747,indoor train car white oven sitting black meter clock track kitchen standing
6748,indoor white refrigerator sitting small sign yellow
6749,indoor person window table room living sitting chair front holding large man white laying dog bed
6750,building grass yellow sitting orange table white red light standing stop cat bus field traffic street night man
6751,screen sitting building clock glass train standing room player woman court large white man ball people kitchen
6752,indoor sitting small cat white bed table laying black room mirror standing computer man sleeping
6753,person cup bottle food table drink hand donut doughnut sitting holding coffee small tray sandwich cellphone beer half eaten plate eating phone sauce pizza glass hot man
6754,person indoor man wearing front standing woman sitting shirt young kitchen holding white table red room
6755,indoor bed room sitting small laptop bedroom light lamp mirror desk computer corner white cat lit laying table living night
6756,window indoor looking sitting front large dark room table man standing people white
6757,indoor sitting paper table small laying pair bear cake white
6758,table sitting covered young bag
6759,text newspaper
6760,indoor sitting table green small pair computer white desk holding blue
6761,indoor table standing red holding room wooden living white board remote luggage playing
6762,person table indoor wooden food sitting plate cake front eating cutting piece small holding little desk young pizza fork woman man bowl baby knife hot board sandwich white phone room
6763,indoor sitting cat front dog laptop red laying bed white table computer room standing man sleeping stuffed
6764,indoor bed building window light room bedroom sitting lit covered hanging large snow white sun man night standing
6765,indoor electronics laptop screen monitor sitting computer table open black room television desk display large white man cat
6766,table indoor cup sitting coffee cellphone food doughnut phone counter donut glass sandwich glasses laying woman white kitchen bed man people
6767,indoor bed room table sitting covered white laying mirror living large sleeping bedroom dog cat
6768,
6769,sitting food
6770,cup indoor table coffee doughnut donut sitting food cake counter computer plate cat eating glass white laying
6771,indoor table desk sitting computer laptop counter keyboard food glass wooden wine sink room kitchen pizza laying white
6772,indoor sitting black food table front close small red white holding
6773,monitor screen looking television front sitting blurry close black table holding woman computer keyboard phone room laptop large white man standing cat
6774,small white
6775,book white
6776,cup indoor food sitting table front computer doughnut laptop counter donut man kitchen glasses dog keyboard woman glass sandwich desk cat coffee young hot mug white pizza standing blender plate
6777,indoor table sitting food laying sign cake white phone plate player
6778,sitting paper table old food laying sign
6779,indoor remote sitting black control table television hand monitor holding laying man room computer large player white cellphone video game bed cat standing blue phone
6780,bed cat food white laying
6781,cat black sitting close white laying food laptop sleeping computer blurry red bed man
6782,person hand holding phone cellphone indoor monitor black small sitting computer screen lit keyboard man palm red white
6783,indoor sitting room building black television small standing front living floor white table holding large playing man
6784,indoor bottle table sitting cup wooden food small glass counter laying beer kitchen water white sandwich coffee cat
6785,indoor sitting white water standing room large refrigerator air kitchen snow bed
6786,indoor table sitting bottle small coffee food kitchen wooden refrigerator little green young donut room computer boy eating laptop bowl white water plate standing
6787,sitting table
6788,person indoor bed laying sitting lying woman man sleeping white holding blanket baby cat room
6789,sitting white black standing man holding young ball room woman kitchen cat playing
6790,indoor thing bottle sitting lotion photo table computer close keyboard black white mouse food bear
6791,indoor wooden sitting black cat table close keyboard computer man mouse young silver standing laying
6792,indoor cabinet sitting stainless microwave steel table kitchen counter silver standing oven large man refrigerator
6793,cabinet indoor black steel kitchen oven stainless silver sitting stove door microwave double
6794,thing clock cellphone table phone sitting monitor surface wooden orange screen black time old standing
6795,indoor table sitting cat cup food small doughnut glass donut laying sandwich white bed
6796,dark table player night standing ball man
6797,indoor sitting table desk laptop computer pizza kitchen man
6798,sitting food table glass mirror water cat man
6799,indoor bottle cup table sitting food coffee open wooden black computer cat desk refrigerator keyboard kitchen red white laying
6800,indoor sitting table plate bowl small white yellow sink
6801,thing indoor bottle sitting can table mug computer desk keyboard white
6802,indoor table sitting small laptop food computer holding desk blue room red man white
6803,sign object thing says sitting orange black red people white group
6804,kitchen sitting red microwave counter table pan white oven
6805,red group cellphone people white table sitting blanket colorful phone woman room shirt stop standing walking man rug game crowd flying field laying
6806,
6807,sitting white black wearing holding man woman standing cat
6808,indoor table bottle sitting counter mirror glass small desk kitchen wooden water sink
6809,indoor table sitting cellphone food phone bottle yellow clock plate
6810,table indoor wooden sitting items mouse desk wood various board computer food holding cutting plate keyboard knife many group white man people
6811,bottle indoor food table sitting can plate banana sandwich bear fries
6812,indoor woman looking refrigerator sitting standing small girl open white mirror young holding little man cat teeth kitchen laying brushing sink room tub
6813,indoor bottle table sitting food refrigerator open counter filled man laying standing black cat donut kitchen cutting white plate sandwich cake water sink dog room
6814,indoor table sitting kitchen counter food white light large sink room pan man bowl pizza stove plate oven night
6815,person indoor sitting man front holding hand looking using computer young table laptop food little woman keyboard phone teeth coffee playing refrigerator remote brushing
6816,indoor green bed table sitting blanket large head room white dog standing laying blue
6817,dark sitting front lit light black night table laptop man computer white standing screen walking cat room ball street player
6818,person holding food man phone
6819,monitor computer
6820,person sitting red teddy small wearing close shirt man holding bear table phone stuffed standing white baseball ball
6821,indoor person computer table desk laptop sitting keyboard office man black phone white mouse room
6822,sitting black computer dark white cat
6823,indoor bottle table kitchen sitting counter food small filled beer wine refrigerator wooden black blender glass microwave plate white water stove pizza standing
6824,table indoor sitting wooden chair shoes computer laptop desk cat black laying small pair mouse lying brown using white holding room standing
6825,indoor sitting black table cellphone phone monitor small red microwave close keyboard computer laying white holding
6826,text book
6827,person indoor man sitting holding hand black shirt laying wearing young cat white head green remote woman standing video hat
6828,indoor sitting computer black laptop desk table screen room white
6829,
6830,indoor cat table sitting black white glass desk standing man laying
6831,dark sitting light black large flying water holding man white air standing red plane room people
6832,indoor bottle cup sitting table food coffee small cat drinking kitchen computer glass dog desk sandwich laptop standing hot mug plate eating man water laying white playing
6833,person indoor blurry man brushing teeth wearing cat hair close red head hat bird mirror holding woman brush reflection phone
6834,food doughnut box table donut paper sitting filled sandwich tray holding bowl plate computer
6835,man wearing mouth cat young white
6836,person man necktie clothing indoor wearing shirt suit front looking photo posing dress young standing table white glasses black hair neck red holding wedding
6837,indoor clothing sitting white small laying person blanket cat orange little bed room dog sleeping standing red shirt group playing
6838,colorful red fabric wearing woman blue man white
6839,mirror yellow sitting photo table small view room phone light clock reflection sink oven keyboard white street bus sign kitchen
6840,bottle thing sitting table cup doughnut donut coffee food small lotion orange laying white dog hot plate
6841,indoor person holding table small sitting hand food desk computer little man black blue young woman room phone lotion remote bed playing standing cat
6842,indoor building floor small sitting rug bed little room empty standing laying television white living bedroom
6843,monitor screen black sitting television close holding clock man player large meter silver cat game display white video
6844,text indoor table book sitting wooden holding food player man
6845,indoor table sitting food plate pizza white close laptop glass large wine red man guitar clock laying
6846,electronics indoor laptop computer sitting monitor screen desk table black open keyboard white
6847,indoor food table bottle sitting small front little plate close kitchen eating white computer sandwich pizza hot red dog cheese refrigerator
6848,person indoor hand food close holding sitting someone pan woman coffee kitchen mug teeth man cat cup
6849,indoor table sitting food black computer glass desk white red room plate game kitchen
6850,person sitting table food small piece plate counter holding red black man blue baseball kitchen bat
6851,indoor sitting table food filled white black pan plate man kitchen oven
6852,indoor building floor man cat white sitting black standing woman room table young dog playing holding living laying red bed
6853,person holding hand man cellphone black phone close table white light blue player
6854,person indoor sitting man table using holding hand woman young room shirt computer laptop remote laying white people video
6855,text indoor book sitting small photo table laying black cat
6856,photo book table sitting computer desk woman phone
6857,indoor cabinet table sitting kitchen room small red wooden white desk living refrigerator oven sink stove man
6858,table orange sitting food red filled oranges bowl
6859,red indoor sitting computer laptop table apple white mouse phone using keyboard black surface desk remote orange control bed plate laying
6860,indoor person holding hand small table sitting food front man white little desk black red kitchen room standing remote phone plate
6861,indoor table wooden sitting desk food brown black white man cutting cat laying board living room plate pizza
6862,text
6863,indoor table sitting food wooden filled computer desk display standing bear
6864,indoor purple sitting pink bed table girl laying white
6865,window star sitting table view light large man blurry glass laptop red rain room street standing night city
6866,indoor food sitting table plate black glass red bowl
6867,person indoor bottle table holding hand food wine sitting wooden small man pizza plate standing kitchen white coffee
6868,outdoor grass building park house field roof area standing bench sitting grassy wooden green path large stone walking eating covered grazing old umbrella garden enclosure group water people street dirt zoo man sheep
6869,indoor sitting bottle table small lotion black open food holding desk phone computer white laying bed
6870,cup table sitting orange bottle food coffee glass computer keyboard pitcher pizza
6871,table indoor sitting wooden small red desk screen
6872,indoor table bottle person sitting wooden food desk water holding wine glass computer man lotion white pizza phone laying
6873,holding comb thing hand object person woman pair white purple remote pink brush blue
6874,indoor person sitting chair blanket table small woman striped bed laying baby phone pink white girl remote cat holding bag man stuffed dog room people
6875,indoor small sitting table cake birthday little wearing white holding blue phone woman man
6876,green sitting table indoor food can wooden painted computer white
6877,indoor bottle table sitting computer cup cake keyboard laptop desk coffee food small counter close white birthday
6878,person man sitting black white wearing head holding remote young blue standing shirt laying hat cat sleeping bed
6879,person indoor sitting front table hand food holding baby man computer woman bottle
6880,indoor table wooden sitting wood kitchen room building small hard floor laptop bowl computer dining desk living large white
6881,indoor window green blurry video woman table playing front sitting game room monitor holding television man young living remote standing
6882,indoor computer electronics sitting keyboard white desk laptop photo table black mouse small water laying
6883,indoor person child bed young small little dog boy laying sitting lying sleeping room cat woman playing standing man blue holding shirt living white people
6884,indoor person small sitting food table bed little black fruit holding remote plate brush man
6885,indoor bottle sitting counter toothbrush food close table black kitchen white brush
6886,
6887,indoor sitting table cellphone small phone wooden silver laying glass old room oven white standing
6888,indoor sitting table black bed laying clock cat computer food laptop room red standing white phone
6889,indoor sitting laying cellphone table phone camera close black clock white
6890,indoor bottle table sitting cup food coffee keyboard counter black close kitchen computer wine glass plate hot white red blender
6891,indoor sitting living table room black man large water kitchen white holding air standing
6892,monitor indoor sitting screen television table phone cellphone front desk small player computer baseball black laptop keyboard old wooden holding white cat display clock game man
6893,cat brown looking standing close front side head bird mouth large orange dog man white red
6894,indoor person sitting table red holding little man young remote
6895,indoor oven stove kitchen microwave small sitting white monitor clock meter computer
6896,indoor cup sitting bowl table orange monitor small close red black round counter white wooden blue plate pan
6897,indoor sitting mirror food table white holding man standing
6898,table sitting food blue
6899,person indoor bottle holding food hand small little sitting table baby man young remote coffee standing
6900,indoor sitting red white small table box open black refrigerator cat kitchen sink room
6901,building photo white sitting table man street
6902,food sitting eaten paper piece table small close donut fork plate pizza holding bowl laying cake white
6903,indoor pizza sitting table food small close wooden plate green red laying
6904,food red black sitting table sign close stop white
6905,indoor orange blue sitting bag wearing red shirt table bed close man pair suit black luggage room white suitcase laying standing
6906,indoor bottle sitting counter laying wine table open surface close brown food black kitchen refrigerator phone white cat
6907,person indoor holding hand man small using food table remote white close someone black cutting woman mouth red people video blue playing teeth room
6908,dog indoor sitting small brown looking lap holding white little black laying table wearing large woman standing bed playing
6909,indoor living room chair furniture table building blue small floor sitting bedroom large white television bed yellow luggage standing
6910,photo orange sitting table man covered painted woman room pizza white laying group phone people standing oranges
6911,person indoor cup man food sitting holding table hand front drinking dark glass black woman pizza cat refrigerator laying
6912,cake indoor table sitting food piece plate birthday sign fruit white
6913,indoor table small sitting colorful monitor wooden computer phone holding bus train
6914,standing dark man sitting night black front large white laptop field screen computer table player riding holding bed street flying red woman room air water board sign ball kite playing
6915,hanging sitting black mounted light lamp white sign kitchen monitor close steel silver stove
6916,indoor sitting table food plate counter microwave dirty pizza water white oven pan laying sink
6917,indoor yellow sitting cat small food doughnut laying standing donut bed sleeping man eating holding table dog blue stuffed
6918,sitting table small television laying food phone pizza
6919,monitor sitting indoor black small white microwave computer laptop oven
6920,phone
6921,clock
6922,text
6923,person indoor black holding woman man young white table red food
6924,indoor sitting table bed red laptop computer phone wine room laying white food
6925,indoor shelf person book sitting man holding using laptop table room glasses computer television white large woman blue young red cat living remote shirt laying
6926,sitting blue water white standing man holding
6927,mirror reflection blurry white
6928,thing indoor object sitting small bowl white brush tiled seat holding man pink remote playing
6929,indoor bed white covered small table sitting fabric zebra black laying mirror plate phone
6930,indoor man sitting table small white wearing mirror shirt desk food kitchen blue standing
6931,food cup filled sitting table coffee fruit sandwich
6932,indoor sitting laptop dark computer cat room bed control laying television lit light remote white table man blurry night standing phone
6933,indoor table desk bottle computer sitting keyboard counter items topped small laptop black phone glass kitchen white holding food blender desktop man brush water mouse refrigerator sink
6934,device
6935,indoor sitting small table old sink man mirror seat white remote food holding pizza room game bed oven kitchen laying
6936,hand holding person someone palm
6937,person indoor table cup holding glass food hand woman man young white water phone standing
6938,table coffee plate cup sitting white game
6939,photo refrigerator sitting open food different many covered white sign
6940,thing table sitting cup food orange laying white plate mug coffee
6941,indoor sitting computer table food refrigerator white laptop kitchen desk counter keyboard
6942,bottle indoor sitting table food wine black glass banana computer wooden desk bowl sandwich laying lotion keyboard red plate
6943,monitor computer sitting laptop apple keyboard light black desk yellow cat screen mouse table white red laying blue night blurry phone
6944,bottle table food sitting banana can sign coffee hot sandwich people plate hotdog
6945,indoor food sitting close phone table bottle
6946,yellow sign sitting white painted green sink blue
6947,indoor bottle table counter sink sitting food kitchen cluttered mirror desk white keyboard plate computer refrigerator green bowl large room man living standing
6948,person young boy girl woman shirt holding little child front birthday cake wearing striped blue standing sitting man remote white sign
6949,cat indoor table sitting wooden wood shoes white piece brown black small laying suit standing red food man
6950,indoor table sitting chair desk small food computer motorcycle white kitchen keyboard room plate laying bag
6951,indoor bottle table sitting glass food wine counter phone glasses close coffee
6952,cup coffee person table food doughnut donut sitting front sandwich drinking man laptop hot eating black little computer plate young woman fruit
6953,sitting book pizza old sign black cake red white
6954,bird
6955,indoor person sitting table cat room front laptop computer desk living brown feet laying man white television bowl holding playing standing remote
6956,person little boy child young food eating holding wearing small plate piece sitting girl using blue shirt mouth table close pair man head phone baseball pizza teeth
6957,indoor living room sitting blurry table television orange woman man yellow large red cat white standing laying
6958,building outdoor car sitting black side door sidewalk seat white street brick parked cat standing man dirty meter city motorcycle
6959,indoor sitting cup table small coffee counter food microwave spoon game keyboard desk kitchen plate black white computer bowl
6960,table sitting wooden blue laying cat
6961,table sitting wooden restaurant desk food
6962,text game sign
6963,indoor bottle person table holding sitting food man white phone laying
6964,table indoor sitting computer desk keyboard wooden mouse laptop small black desktop phone white plate player
6965,indoor bottle sitting table food computer monitor desk laying laptop phone holding water cat red white coffee bed
6966,eating food close dog hand holding bite sitting small donut mouth bird man laying blurry white standing
6967,floor indoor room living table sitting large television furniture black woman desk standing computer white cat people fire
6968,indoor table cup sitting coffee small eating food black plate desk computer blue laptop yellow holding keyboard white cat kitchen hat bed
6969,dark white sitting black man front standing large table laptop night holding light woman computer screen bed room flying player field riding air cat kite people street
6970,food
6971,person indoor bed sitting woman tattoo wearing phone white young girl shirt holding head table man
6972,indoor person sitting table black holding man red cat white computer laying laptop wearing young phone standing room
6973,indoor book bottle shelf sitting food table small filled computer black keyboard wine desk white room
6974,indoor sitting laptop computer table white black man laying cat room
6975,cup coffee table indoor sitting drink glass food keyboard computer desk laptop phone donut sandwich blue water mug bed
6976,thing clock object monitor sitting black white
6977,person looking front woman man holding mirror
6978,yellow sitting fire hydrant brown laying field large covered standing white street
6979,sitting white bowl front plate wooden table black old frisbee large sign dirty game room necklace
6980,indoor table sitting laptop front woman mirror computer desk room boat man white food standing kitchen water plane airplane
6981,sitting suitcase indoor luggage cellphone black piece phone bag table red opened speaker laying orange white
6982,indoor table bottle sitting computer coffee food wooden laptop small keyboard black desk wine glass plate sandwich laying kitchen
6983,indoor thing object white sitting small tile tub tiled bowl yellow room seat sink water dirty airplane shower plane
6984,floor indoor sitting red dog building apple room small table playing front cat little large food brown living standing young laying orange kitchen computer laptop bowl white board group
6985,striped bed blanket sitting table cat colorful laying room white standing
6986,man white sitting close table cat mirror standing wearing laying blue phone plate room
6987,monitor table screen blue television sign light
6988,sign sitting food standing man red white
6989,indoor table sitting small desk blue holding white computer laying keyboard plate cat
6990,person man holding wearing suitcase luggage cat white standing bed phone
6991,text food
6992,indoor sitting black table food kitchen stove pot wooden counter bowl water microwave oven pan pizza cooking hot laying plate
6993,indoor person sitting table man living holding laptop laying computer room lying cat television woman young phone standing people
6994,indoor table small sitting blue holding filled pair computer food water white
6995,indoor person food doughnut donut sitting chocolate woman holding little cake black young girl wearing table baseball man white coffee
6996,indoor table food sitting fruit paper plate filled laptop computer holding laying man white
6997,
6998,person indoor sitting computer table laptop man front wooden bench room desk holding people laying
6999,outdoor road street person man black riding walking standing board woman hydrant white bird parking city
7000,indoor bottle sitting food table toothbrush filled close donut bowl laying pizza brush white plate
7001,sitting table food lotion laying bottle
7002,bottle indoor sitting table pizza food laying wine water holding wooden phone
7003,text whiteboard
7004,bottle
7005,indoor sitting table food small computer black yellow phone desk holding man sandwich standing people plate
7006,electronics circuit
7007,table wooden indoor sitting black food white laptop apple computer standing phone clock
7008,indoor table sitting food small black cat phone yellow laying holding man plate
7009,indoor sitting bed laying white small lying young black shirt man
7010,sitting table close food orange glass plastic brush holding laying red
7011,indoor sitting cake small table birthday little paper food laying red bed
7012,necktie wearing person shirt close neck man red suit yellow blue fabric striped dress black closeup bag gold white
