id,image_feature
6218,clothing indoor fabric room black painting many large man living white old table green painted blue bed refrigerator kitchen
6219,text newspaper sitting table
6220,indoor cup sitting table bottle coffee food small close black keyboard computer plate red white cat
6221,text
6222,abstract computer laptop keyboard
6223,indoor sitting table hand glass pair close black clock food counter holding display wine white cut phone red clear sign
6224,bottle indoor sitting open wine book table laying food lotion small black empty close banana holding phone cat bed
6225,indoor table sitting pair black standing holding man laying white gold room vase cat blue
6226,person holding indoor hand small table food front black baby sitting close screen man phone orange television kitchen remote
6227,cat indoor standing sitting looking brown black white grey head laying room kitchen
6228,indoor sitting toothbrush close brush computer remote monitor video game white control laptop playing blurry mouse room
6229,thing indoor sitting pink table small red phone bed brush laying white holding purple remote
6230,food table can hot fries sitting dog restaurant plate sandwich eating hotdog
6231,table phone
6232,remote electronics black sitting control lying laying cellphone table different surface light large television ball game white
6233,mirror man reflection blurry train doing
6234,indoor person table man sitting food woman shirt holding white laying bed red young remote phone
6235,indoor sitting monitor computer bed laptop table desk small television lamp screen large dark white black light room holding red man cat
6236,indoor table bottle sitting orange kitchen counter desk phone computer room glass food yellow white
6237,clothing person bed blanket laying wearing bag sitting sweater little lying girl pink woman sleeping holding white man black purple suitcase suit head young shirt luggage blue cat
6238,game food laying
6239,indoor object thing computer keyboard sitting laptop open mouse table laying white bed
6240,food rug
6241,flying sitting computer laptop white large monitor air bird phone room
6242,indoor sitting food table covered filled white laying bed
6243,sitting white computer room laptop table standing man light holding laying cat woman desk bed red
6244,person indoor holding cellphone phone hand table sitting food close man glass lotion laying remote
6245,electronics person remote holding keyboard hand black cellphone control man monitor close front sitting game computer television video playing laying
6246,outdoor road street grass sidewalk side sitting hydrant man fire stop parked path bench board sign walking riding city brick boy standing motorcycle young air green red park white laying parking jumping traffic trick ramp doing bus
6247,sitting food woman holding man table mirror pizza game dog young white laying room sink remote video bed blue
6248,indoor sitting table plate small food black coffee laying cat holding pizza white
6249,indoor laptop sitting table computer desk open monitor front wooden keyboard screen room white laying pizza bed
6250,indoor sitting table computer desk laptop keyboard holding standing food room man
6251,indoor table sitting book bed wooden room living red food white laying phone
6252,indoor book items table toy covered sitting small filled colorful many bag different little computer laying suitcase bed group room playing
6253,green sitting black table laying computer cat man sign white board phone
6254,outdoor grass plant tree forest bushes path standing elephant area dirt sitting trail palm green field large park bench riding grassy man garden giraffe street walking grazing zebra group tall water river parked red herd people
6255,indoor bottle sitting table filled small open food black empty counter white kitchen
6256,indoor sitting small wooden black bed table laying white cat room dirty bench seat blue sleeping luggage
6257,person indoor cup holding hand small table food sitting little close blender can baby man coffee phone
6258,indoor table sitting cup desk computer food kitchen counter keyboard glass black wooden bottle white standing coffee
6259,text
6260,indoor sitting remote black game table television control holding knife video large group playing room man bag white cat
6261,bottle beverage sitting table food glass counter painted
6262,indoor sitting bottle container table food cup tray small filled plastic kitchen counter water computer bowl desk phone laying keyboard banana plate pizza fruit mouse
6263,sitting man white someone dark black red laptop light phone holding room
6264,indoor sitting table bird laptop food man black cat close large computer woman holding pizza room blurry standing video white
6265,indoor table sitting desk computer small game remote video keyboard wooden playing man laptop room phone black holding white wii mouse bed
6266,bottle indoor sitting table black food close green wine computer red white
6267,dog indoor sitting rug laying brown lying living room white small black large blanket red table sleeping bed cat
6268,phone black meter
6269,indoor sitting small box food white table sink laying red pink
6270,person cup indoor beverage food table coffee sitting red glass computer man phone sandwich eating woman
6271,black bag laying white shirt hat standing
6272,person holding monitor screen man hand sitting phone television cat laying table young woman computer bed
6273,blue table sitting plate black meter clock white
6274,person indoor holding cellphone phone hand monitor small sitting table black old held front screen man someone palm video playing
6275,shirt close man orange wearing white suit bag
6276,dark laptop sitting light computer monitor front lit screen black room television white flying cat street man night standing bed air
6277,indoor table cup sitting computer food coffee laptop desk small keyboard counter glass laying donut red white kitchen plate bear
6278,white bird
6279,white photo flower woman plate sitting table large cake holding blue black cat bear man dog sleeping laying drawn stuffed bed vase
6280,person clothing indoor shirt bed sitting white man wearing black holding young green blanket little head red laying woman girl sleeping remote phone standing
6281,indoor sitting small table black suitcase phone white luggage
6282,indoor sitting remote black table speaker row wooden lined cellphone different computer control white laying clock kitchen
6283,indoor sitting table remote black computer different surface cellphone control keyboard
6284,sitting different black side monitor close screen display several holding man group white
6285,red building outdoor sitting stop front sign street wearing white brick standing table covered holding hat graffiti fire snow
6286,fabric room bag bed
6287,indoor white sitting small microwave table sink tiled oven kitchen dirty plate
6288,person indoor holding hand food toothbrush small little using woman front young close teeth man brush boy pair phone mirror brushing kitchen standing
6289,bottle indoor table sitting wine food small kitchen computer black counter desk plate keyboard white phone water laying
6290,indoor sitting table kitchen living room small television white computer laying man
6291,indoor sitting laying bed pair blanket wearing small table striped white red lying man black hair neck bag plate
6292,indoor sitting phone cellphone table open man book laying computer lying close laptop green white black bed cat
6293,text
6294,beverage food sign stop sitting table can covered
6295,thing red monitor light blurry background sign traffic television close sitting street bright dark stop clock large city white
6296,smoke bird train
6297,indoor sitting table book food black filled counter fruit white
6298,indoor person screen abstract small red tattoo white towel bed man standing
6299,indoor bottle thing sitting table lotion open black food white computer
6300,sitting thing table lotion black laying counter white pizza
6301,blurry holding man cat bird woman standing
6302,indoor food dog sitting table hot black white holding cat plate bed eating fruit hotdog room man sandwich standing red laying
6303,indoor sitting table laying black wooden suitcase cat man standing luggage white phone remote room
6304,person close monitor man blue woman holding white
6305,indoor table sitting red small food shoes wearing pair pink white phone wooden bag standing blue laying
6306,book sitting screen laptop table computer cat
6307,indoor monitor screen laptop sitting table computer front open large light standing desk black room man display television phone holding water night white air video player
6308,indoor refrigerator sitting steel clock door stainless kitchen standing silver large close white sign red man room
6309,indoor food sitting table coffee
6310,food holding hand red sitting close man table bottle white blurry
6311,indoor red sitting white man black table door woman standing holding food room refrigerator phone kitchen laying cat playing
6312,cup container coffee sitting table mug can glass food black wooden close keyboard
6313,bottle indoor table sitting food wine banana glass sandwich coffee plate
6314,person holding hand phone cellphone monitor indoor small black palm held someone screen man front close lit
6315,indoor mirror photo white small sitting light view table shower room sink large clock refrigerator standing
6316,sitting black white table laying dog laptop bed cat blue man standing blurry
6317,computer indoor desk electronics keyboard table laptop monitor sitting mouse desktop black office wooden playing man player
6318,indoor book sitting monitor black close box open table computer game clock holding white laying phone
6319,indoor small sitting refrigerator room open white desk table computer bed sink kitchen
6320,indoor cup food table bottle sitting coffee banana fruit plate laying phone
6321,indoor cat white large man laying bed holding woman standing playing room
6322,monitor indoor microwave cellphone sitting phone table counter small old device surface clock oven screen silver display laying kitchen white
6323,book text person indoor man sitting holding black laptop computer phone wearing young bed laying
6324,table cup indoor bottle coffee sitting drink food computer beer glass front keyboard drinking plate desk sandwich laptop kitchen black banana wine dog hot white
6325,food table indoor sitting doughnut small fruit filled plate tray donut counter glass sandwich cake display oranges red soup
6326,car oven photo sitting pizza cake door sign cooking food white laying bus stove train pan bed
6327,indoor table person sitting cake red food small front little looking holding boy young man plate woman white girl birthday room cat standing
6328,text riding city water woman street
6329,indoor sitting piece laying leather book striped table blanket rug lying green yellow cat train phone red blue remote white group
6330,person cup orange cat food table hot sitting dog wearing shoes feet holding man black pair hotdog close eating red grey standing yellow laying
6331,black standing dark white man large sitting night laptop field table holding flying bed screen player computer woman kite water air room riding street ball people cat
6332,sitting looking cat woman laying man bed blurry white reflection laptop sleeping
6333,outdoor cloudy car plane parked clouds light sitting street airplane black large traffic truck air white runway jet red standing riding man people
6334,indoor sitting table front black computer laptop food desk cat holding white phone red laying man
6335,umbrella open decorated large clock table city holding white people street man
6336,bottle sitting food sign black red close banana plate white
6337,thing indoor watch object sitting table black orange clock hand phone close wooden laying cat man white standing
6338,dark sitting cat white screen standing man monitor black night lit light holding television door large red table room computer laying blue vase bed
6339,indoor table sitting bottle coffee cup computer laptop desk small keyboard cat counter glass kitchen water blue room food white mouse standing phone
6340,sitting side street sign white table city brick parked man
6341,indoor sitting white table laptop standing room computer black large desk kitchen man laying
6342,indoor sitting cat white close room man table laying bed standing head young pizza living sleeping zebra
6343,indoor person man white dark shirt black holding young light bed woman wearing large room standing night laying blue
6344,dog indoor black sitting small front table standing desk laying wearing room bed brown playing cat mouth white large red computer blue
6345,black dark looking front sitting cat standing man white holding room flying field air red bed night player
6346,bottle sitting indoor table food front wine lotion computer wooden
6347,indoor person table sitting food black front book woman standing wooden desk baby computer phone cat holding laying man kitchen
6348,indoor small sitting red blue table white black holding clock display
6349,sign sitting white table black holding computer
6350,indoor sitting computer laptop monitor dark screen desk man black red holding table white bed blurry cat room
6351,indoor person table bottle sitting food toothbrush holding little small hand wine cutting wooden young brush glass man cake dog eating sandwich pizza board
6352,cup coffee sitting thing table bottle doughnut donut small lotion counter white laying
6353,cat indoor dog cabinet looking sitting front standing brown wooden white small kitchen sleeping bench laying oven playing man
6354,green indoor table food sitting fork small close plate phone cake sign white pizza
6355,black dark standing man night white sitting laptop bed large field water light table computer flying holding player woman cat street air room riding ball playing kite laying
6356,person indoor hand holding man sitting table food old cat white phone
6357,sitting table light counter close food white laying night yellow room game clock plate
6358,indoor table room sitting small building black red laptop computer white desk bed floor living wooden bedroom large mirror night cat
6359,person indoor table sitting holding child young small laptop woman little computer boy cake playing man food plate blue eating game phone sign white
6360,person indoor sitting holding table woman girl man green little wearing young phone food laying pink dog hat white sleeping stuffed
6361,indoor cup table coffee sitting food plate glass laptop white cat room sandwich red laying bed phone
6362,food sitting orange table phone sign
6363,indoor sitting table food holding orange cat woman bed plate bowl man laying white room
6364,indoor table coffee cup sitting computer desk food small laptop black wooden glass room can keyboard living white plate kitchen
6365,thing bicycle engine
6366,person indoor sitting red holding hand small food table man book phone glasses young woman remote laptop laying plate room sleeping video
6367,person indoor blue wearing woman holding small young standing glasses shirt hair black man pair red girl yellow phone white purple hat
6368,indoor table sitting man food covered filled laptop computer young holding standing laying remote bed dog people room
6369,indoor table small holding girl sitting front woman hand using kitchen little standing wooden young man phone laptop desk computer room brush white
6370,person indoor man holding sitting small pair black wearing table plate old phone white standing bed
6371,indoor sitting small black different blue table monitor computer laying purple white
6372,sitting small white black side table red
6373,electronics bottle computer sitting monitor black laptop table keyboard people sign man white
6374,table indoor bean sitting food green counter small white black plate fruit broccoli board laying
6375,person indoor white man wearing black sitting bed shirt laying young table woman sleeping cat standing
6376,indoor bottle food sitting stop sign table
6377,food sign
6378,person man standing wearing holding close white glasses large umbrella field hat bed stuffed street laying room
6379,person indoor clothing blue legs feet man sweater bed looking wearing cat close sitting laying gray blanket shirt standing phone grey dog holding woman white remote people
6380,indoor mammal animal brown standing cat horse laying looking white head dog large man sleeping wooden kitchen
6381,indoor table sitting laptop desk computer mirror man room white food wooden large restaurant yellow pizza cat plate standing sleeping bed
6382,
6383,indoor cake table plate food birthday sitting decorated filled chocolate glass white
6384,man air sitting white snow black side light ramp jumping night riding board large computer flying plane sky doing trick standing
6385,sitting table laying book piece food
6386,indoor keyboard sitting small computer table laptop white desk laying black mouse pair woman holding phone bed room man
6387,bottle person indoor beverage food sitting front wine holding open hand table close man glass laying phone sandwich standing pizza plate
6388,laptop electronics computer indoor sitting open table desk lap keyboard black mouse opened small screen white silver wooden cat bed
6389,indoor sitting small food table close white can bowl wooden red holding plate blue laying
6390,indoor person hand small holding sitting close food book table red orange phone lotion white laying brush
6391,person indoor holding table hand looking food front man red sitting glass orange phone woman standing bottle room kitchen
6392,indoor yellow sitting sign close black white food red keyboard blue plate
6393,indoor mammal white cat brown standing sitting black dog room laying man young large head bed living sleeping
6394,bottle indoor table sitting book glass food green black wine phone computer desk pizza stacked
6395,indoor food sitting woman young man room blurry living holding playing mirror remote standing video game laying table
6396,indoor table mirror room kitchen small holding living white man desk laptop wooden computer woman standing plate bed cat sink
6397,indoor shoes laying sitting kitchen lying cat dog building counter black floor table feet oven food standing man pair white stove woman wooden sink refrigerator sleeping
6398,black dark sitting white night laptop large man standing computer table light holding woman riding bed field street sign room flying player air cat ball
6399,indoor sitting table food kitchen cat woman counter man laptop dog laying standing computer eating white plate water playing room sink stove people
6400,indoor sitting bed cat laying book shoes table black white wooden laptop room man sleeping
6401,monitor indoor screen sitting table computer black blue laptop desk television phone keyboard white large clock
6402,indoor window chair sitting table bag room large seat man mirror train white living blue bus double
6403,indoor sitting small laying cellphone pair table phone green white food board
6404,text computer
6405,text
6406,person man white striped black wearing bed holding blurry standing reflection red young cat shirt
6407,indoor sitting black white brown computer cat table large room desk standing green laptop man shower
6408,black photo white sign food soup mug
6409,sitting
6410,standing black dark white sitting man night large field flying laptop player water woman riding bed air holding kite ball board street cat room playing sign
6411,indoor table sitting white mouse desk computer black phone keyboard sink laying
6412,person indoor holding hand green food man small cat sitting close remote game playing player phone
6413,bottle food sitting table sign
6414,person indoor holding red looking shirt sitting young pink little front girl wearing small hand woman man remote phone using control boy video screen baby food cat teeth brushing white bed wii brush playing
6415,monitor table screen sitting computer desk keyboard television display sign
6416,indoor sitting bottle laying counter small open table food lying pizza dog kitchen white
6417,table sitting blue yellow blanket bag white red man group laying
6418,food indoor pizza close closeup plate dog blurry photo sitting toppings view cheese hot white table red pan
6419,indoor cup table mirror sitting food hand holding orange toothbrush close eating plate reflection glass bottle kitchen red teeth man remote sink
6420,monitor
6421,indoor stereo sitting computer white mouse keyboard remote table black control close laptop laying
6422,indoor bed person laying sitting man blanket clothes lying sleeping cat white remote blue shirt covered holding
6423,indoor person living sitting table room looking man laptop television orange young holding woman food white
6424,indoor cup table sitting front food small holding man cat black standing young laptop cake woman glass phone playing room white laying
6425,text
6426,
6427,person indoor holding small hand boy man baby looking child young little brushing front sitting using table shirt teeth food orange red wearing white bed playing eating standing brush kitchen sink remote room
6428,sitting computer table monitor keyboard phone white
6429,sitting table white bed
6430,bottle indoor table sitting counter food topped kitchen wine beer black large blender glass wooden sandwich cheese standing blue yellow white man cat plate sink
6431,indoor sitting laying lying bed small white man cat orange table yellow holding phone sleeping shirt
6432,indoor sitting shoes leather table brown piece feet orange white red laying dog hot room plate cat phone blue game
6433,sitting table small food book filled little brown plate white bear
6434,indoor table sitting food computer keyboard red front desk kitchen stop coffee plate train sign
6435,
6436,indoor sitting mirror computer monitor laptop window reflection small view table screen keyboard phone holding white door television desk standing woman man red room cat
6437,indoor person holding hand sitting phone man table computer remote white
6438,monitor indoor clock sitting black small silver oven mounted different microwave white display screen meter
6439,sign white sitting street black holding clock man people standing
6440,indoor food beverage bottle table sitting blue wine holding close glass red kitchen plate white
6441,table knife
6442,cup coffee table indoor keyboard computer sitting laptop desk drink food glass breakfast mouse doughnut desktop donut close phone hot white sandwich plate
6443,thing stop red food sign
6444,table sitting red book laying white
6445,table
6446,table indoor text sitting wooden piece
6447,building red sign sitting table man black white holding woman large standing restaurant food phone remote bus
6448,food sitting laying table white plate
6449,table sitting wooden old bus room
6450,indoor television sitting table monitor living small room computer remote food laptop control video laying playing desk game holding cat white blurry kitchen
6451,indoor sitting bed laying black table shoes white pair cat mouse bag phone
6452,table indoor wooden sitting wood open apple knife half cut food white board laying cutting computer plate man frisbee
6453,indoor sitting cup table small plastic food counter black white coffee plate blue laying
6454,cellphone sitting phone indoor table monitor black old wooden player
6455,cup coffee table plate indoor sitting food small spoon wooden breakfast piece fruit cake fork chocolate glass white bowl banana keyboard laptop computer blue
6456,indoor laying bed lying head brown dog sitting sleeping blanket white covered cat standing room
6457,bottle indoor table sitting cup black wine glass food computer keyboard wooden green counter beer desk plate water white kitchen
6458,green sitting front mirror room table close ball holding sign keyboard player woman man reflection standing playing phone court
6459,indoor monitor electronics computer sitting table desk laptop screen television keyboard small wooden black desktop white large holding blue cat room man
6460,indoor bottle table cup sitting food tray front filled water glass man holding counter phone refrigerator woman lotion plate kitchen
6461,black standing dark man white sitting large field laptop water flying holding night table woman bed player room kite street riding playing air cat people ball
6462,outdoor sun sunset road track day street traveling clouds water man train side sign red riding light city cloudy standing flying traffic people field board white air
6463,indoor sitting table food white refrigerator man laying cat room standing bed
6464,text
6465,indoor sitting white small counter kitchen microwave table box sink refrigerator black tub blue oven pink stove phone plate
6466,sitting sign front yellow table food close red white stop room standing blurry
6467,shelf shop store different table display bunch filled counter many large food group player man room standing playing street
6468,
6469,monitor screen cellphone close phone someone blurry man
6470,indoor curtain clothing towel sitting rack white hair table shower wearing clothes hanging man large standing sink closed group
6471,indoor photo painted old painting building decorated sitting red colorful black room man yellow large woman white table clock standing window double
6472,laptop indoor sitting computer electronics table open small black desk wooden surface opened counter mouse white keyboard phone
6473,indoor sitting small microwave table refrigerator oven laying stove kitchen white
6474,food sign
6475,indoor gallery photo scene room painting hanging man mounted white mirror sitting sink small woman painted green light sign large bed clock bedroom standing
6476,sitting black cup food can orange table close cat red
6477,indoor electronics keyboard computer sitting table mouse desk white wooden laptop man board standing laying
