id,image_feature
7013,bed indoor laying pillow covered blanket lying white bedroom sleeping dog snow room
7014,indoor oven cabinet stove sitting kitchen microwave stainless steel black white silver
7015,dog indoor monitor computer screenshot sitting screen front small keyboard laying brown desk holding laptop man television table
7016,
7017,indoor table car sitting room living cat man television standing young video holding laying people riding white playing
7018,thing object clock old black monitor sitting side time white woman standing display street
7019,abstract mirror
7020,dog yellow sitting holding brown cat table laying wearing man mouth bed standing white riding
7021,food sitting counter coffee
7022,person indoor man food table sitting laptop holding using computer pair phone young wearing red remote video plate standing white people playing shirt blue
7023,indoor person sitting holding remote white game man video playing wii young refrigerator bed
7024,indoor sitting black building table boat white large board water man standing clock bed
7025,indoor door mirror white small sitting standing sink restroom tiled room man phone clock shower cat teeth
7026,cellphone phone table indoor stereo electronics sitting old holding lying wooden black laying remote computer
7027,indoor sitting looking yellow holding front black laying food woman red dog white frisbee
7028,red photo sitting side white table bus man
7029,indoor food table sitting filled fruit small wooden box plastic bowl orange oranges plate laying
7030,food fruit
7031,food banana table sitting wooden piece small laying slice fruit cutting board black cut close knife red white dog blue
7032,indoor table sitting food box book filled red wooden plate laying pizza bed
7033,indoor hand holding sitting food lotion
7034,photo table sitting man black monitor woman white screen sign people television standing holding large cat
7035,text
7036,red table small sitting large white wearing orange yellow glasses hat holding necklace phone woman
7037,indoor person sitting man oven black table young holding laptop pizza woman white kitchen computer cat stove standing room playing
7038,sitting small old man white laying cake table beach water standing bed suitcase riding sand room
7039,table indoor sitting wooden desk computer laptop laying phone board mouse white
7040,table sitting wooden laying
7041,indoor sitting room table living small playing laptop young standing laying bed video holding white remote cat game man
7042,indoor clothing white man shirt wearing laying sitting striped table close bed blue plate
7043,table cup indoor food sitting bottle fruit glass coffee banana filled small oranges orange black bowl wooden plate white
7044,dark room white bed
7045,sign food bottle cat sitting black close white coffee
7046,person indoor man front table looking sitting standing computer monitor television food woman cat laptop playing desk holding room keyboard dog remote white living video
7047,indoor sitting different table filled bunch many white covered food
7048,monitor screen television front sitting man large holding dark mounted blue woman clock blurry
7049,indoor kitchenware black sitting strainer man pan board computer wooden young laying bed room microwave
7050,indoor black sitting side half game bowl light close air night white mirror plane pan
7051,indoor sitting table green black car monitor dryer seat computer white laying cat
7052,indoor red person orange sitting table wearing bed man laying shirt cat large sleeping woman white bag standing room
7053,indoor table food sitting items desk computer plate book wooden keyboard cake white laying
7054,car view sitting front window looking computer driving keyboard laptop light head man riding cat traffic
7055,sitting table hat shirt white cat
7056,person holding hand phone woman man blue young food
7057,food indoor hot box table sandwich red sitting small pizza dog little hotdog holding eating plate standing
7058,indoor mirror sitting small looking reflection view man room blurry train yellow seat woman door computer holding cat white bed standing laying
7059,indoor sitting small cat room black white wooden green table seat laying living bed sleeping remote standing
7060,white plane food room airplane light
7061,indoor sitting food front looking table laptop man close computer dog holding laying standing white
7062,indoor monitor machine silver meter oven
7063,table food
7064,
7065,indoor television monitor screen sitting front small set flat standing holding large table light playing room man display living white game video
7066,standing sitting white large room green rug living cat man bed sheep group holding snow people laying field
7067,cup indoor sitting bottle table food lotion computer mug keyboard white holding cat
7068,indoor white sitting seat small open public view brown restroom
7069,indoor white small sitting wooden red table counter room bowl kitchen clock sink shower tub standing
7070,indoor cabinet sitting small white table food bed wooden cat plate laying kitchen stuffed
7071,text computer
7072,bottle indoor table sitting food coffee laying open computer black laptop plate hot phone man white woman fruit standing cat room
7073,sitting indoor table black game white laying computer mouse standing
7074,indoor small sitting table filled food pink room little white holding computer old cake fruit plate covered standing cat kitchen young blender living dirty water bed man red stuffed phone bear sink playing remote oven stove
7075,food plate table sitting white rice meat fruit computer hot broccoli bowl
7076,indoor table flower sitting vase small window food filled hanging bird fruit black red glass wooden green desk clear bowl mirror white plate
7077,beverage food sitting blue black red white sign cat
7078,person holding hand table man small red front using cutting close screen food desk black young computer white
7079,indoor sitting looking man food cat white blurry holding room
7080,indoor photo oven kitchen mounted small sitting microwave room hanging fire table stove living television red large refrigerator man white sink
7081,cat indoor black sitting looking laying table white front box desk standing computer playing laptop sleeping keyboard yellow perched bed
7082,person indoor hand holding remote small table sitting black control laying old white phone plate
7083,indoor table cellphone sitting phone laying wooden surface lying black different brown player old baseball white clock ball
7084,bottle indoor sitting table close monitor glass black lotion cat desk counter orange screen food wine computer laying white red
7085,thing lotion sitting keyboard book monitor close black computer phone food
7086,sitting white side black table standing room phone meter man
7087,thing bottle sitting table lotion red food laying
7088,monitor indoor sitting screen computer laptop television table black desk green cat phone video
7089,cup table sitting indoor coffee food glass sandwich beer banana black donut phone laying red mug cat
7090,indoor person table sitting man computer window laptop front desk food young green holding pizza game plate room eating restaurant playing video remote living people wii
7091,indoor table cup bottle food sitting glass water laying white plate phone sandwich
7092,food sitting banana close red table sign
7093,sitting table bag holding bed purple
7094,indoor sitting table food red small glass counter fruit can black apple cat
7095,person man shirt wearing white green close young holding black standing head blue teeth
7096,sitting sign yellow street light white pole game mirror green sink table tall traffic standing night red blue man train room
7097,indoor monitor microwave clock small sitting photo television screen phone cellphone old red table laying computer white oven display
7098,indoor white sitting small view seat tub shower water dirty sink room plane man light
7099,
7100,table food indoor sitting pizza wooden slice plate piece holding knife board fruit cutting cake eating white water cheese man broccoli
7101,table indoor cake plate sitting food wooden small knife blue phone cutting holding bear
7102,indoor table sitting computer desk laptop small mouse food keyboard plate wooden cake holding remote white cat laying phone video
7103,indoor object clock hand sitting monitor black computer meter white
7104,indoor thing object monitor sitting clock small remote white black video game table television control room
7105,laptop computer monitor electronics screen sitting keyboard
7106,cup table indoor coffee sitting food small front plate hot keyboard desk laptop red kitchen computer white glass sandwich phone
7107,text
7108,indoor bed sitting green laying looking laptop small white lying baby blanket cat table woman room computer holding
7109,table sitting food orange bowl woman holding fruit standing phone man room white kitchen
7110,bed sitting book laying riding lying table bag man holding food suitcase cat luggage
7111,indoor sitting game white table video remote meter room
7112,indoor sitting small table pair laying white red
7113,indoor white sitting table black small pair sink laying mouse holding mirror room water cat
7114,red indoor table colorful blanket white sitting bottle covered close phone yellow food holding blue
7115,bottle table indoor food sitting counter water kitchen standing front filled woman empty desk man glass computer people refrigerator group dog sink laying white plate phone
7116,person holding indoor hand front cup toothbrush sitting small food phone cellphone screen control table black remote lit man coffee bed brush white
7117,indoor table sitting food tray counter cake black chocolate laying plate coffee kitchen
7118,person indoor front sitting man holding small food young wearing little boy hand donut kitchen shirt woman mirror standing pizza sink
7119,monitor indoor screen hand small looking face black table close sitting clock holding computer keyboard blue white
7120,black sitting phone monitor cellphone dark screen computer parking street laptop close table meter white city
7121,table indoor bottle sitting glass food cup wooden counter kitchen green wine small water beer banana desk bowl blender computer white laying plate cat
7122,indoor sitting table food cup pan black banana plate cake chocolate kitchen bowl cooking cat stove fruit pizza cut white laying oven holding
7123,sign stop sitting red black food standing white
7124,monitor television video large front screen table blurry standing man room bird game
7125,text book man sitting table monitor television holding standing old screen woman playing player display people game ball pizza bus
7126,green man white standing room water woman ball player
7127,
7128,indoor table sitting computer laptop desk yellow keyboard phone mirror room close fire white red standing cat man hydrant blurry laying
7129,bottle indoor wine table food sitting glass beer close holding black computer banana bowl plate sandwich red pizza
7130,green sitting front refrigerator black door standing white room street
7131,indoor thing sitting photo monitor white clock green computer sign phone
7132,monitor thing screen television sitting computer dark clock laptop keyboard front desk close lit table meter phone light room desktop blurry bed
7133,indoor sitting computer black table keyboard mouse desk small front white laying apple laptop desktop
7134,person holding woman white man sitting black young light table bed wearing head standing night laying large laptop room playing blurry
7135,indoor colorful sitting book table laying small laptop bed covered blanket little different orange computer sleeping room cat remote phone stuffed
7136,indoor sitting table bottle cup food small white computer coffee black keyboard plate kitchen laying mouse blue bed
7137,sitting black table white plate man laying room standing
7138,indoor sitting small door yellow refrigerator kitchen wooden floor table mirror man room standing young holding laying dog white cat phone
7139,indoor sitting table monitor black laying remote computer phone red room white clock
7140,indoor table sitting room white desk kitchen cat standing red food laying sink
7141,indoor person boy young sitting little holding child small food donut woman laying table playing man eating cake standing cat bear white pizza
7142,person indoor holding bottle man sitting hand front small food table laptop young computer woman red phone room
7143,indoor dog sitting bed small laying table stuffed lying sleeping brown red bag blanket cat white man pink standing bear room
7144,implement stationary indoor thing pen toothbrush green brush sitting small pair white different plastic sink display
7145,yellow indoor sitting bed black laying food cat
7146,text table
7147,cabinet indoor kitchen refrigerator bottle food sitting counter table small microwave open beer water black wooden white covered oven stove dog laying room sink
7148,table sitting holding large white water woman man standing red room group playing kite player people air ball flying
7149,indoor bottle food table sitting banana can close cake baby plate coffee
7150,sitting table cat man laying white clock mirror woman standing
7151,indoor thing bottle sitting white machine black table phone meter parking sign standing
7152,screenshot food
7153,indoor dog white front small room standing sitting playing brown laying cat holding man black woman large living food game kitchen
7154,red stop sign sitting food orange table white
7155,window view building large mountain beach sitting city ocean overlooking open field train standing white bus water man track
7156,sitting white small tree covered black umbrella vase table standing holding man bird water street rain laying snow bear room flying
7157,indoor sitting paper table book food plate desk white laying
7158,monitor white screen man red drawing blue
7159,indoor table sitting small food desk wooden black white kitchen computer plate laying room
7160,sitting table food book laying white cat standing man room bed
7161,indoor table sitting cellphone phone monitor wooden computer light white water room blue clock
7162,table indoor keyboard sitting computer food wooden desk mouse laying
7163,indoor bottle table sitting small food filled desk glass computer water wooden white vase kitchen
7164,person man white sitting wearing laying shirt close black blue bed holding suit table young cat sleeping phone standing
7165,cup indoor bottle coffee table sitting food donut hot filled sandwich counter kitchen blender plate
7166,indoor table sitting cup plate small desk computer white game laying
7167,indoor table sitting food items can bag blue filled remote laying coffee plate phone
7168,black man sitting dark white standing front large wearing holding room door table laptop woman cat red night bed
7169,food
7170,table cellphone laying sitting small plastic food lying phone green holding water
7171,indoor mirror sitting man reflection blurry holding woman teeth food white room standing red cat brushing blue sink
7172,indoor object thing lamp room dark lit table sitting small light living black yellow hotel desk bed night hanging white clock
7173,woman holding black blue white man playing bed ball
7174,photo desk table computer food
7175,indoor sitting white black light computer keyboard man laying mouse bed airplane
7176,photo painting drawn old holding woman table painted large bus red white man room graffiti
7177,indoor sitting cup table bottle white coffee toothbrush food small computer keyboard orange counter close plate desk black brush kitchen red mouse laying
7178,sitting table
7179,indoor sitting white mirror red man woman wearing young phone standing room shower brushing laying teeth blue sink
7180,indoor table wooden sitting desk food small plastic red apple holding plate computer player laying brush baseball
7181,indoor flower vase table sitting small glass white filled fruit counter desk green red wooden clear holding food large tall water
7182,indoor table sitting monitor device doughnut donut food computer plate black desk phone remote
7183,indoor sitting toothbrush orange close monitor white red laying game
7184,person indoor holding thing man small table hand sitting food lotion phone glass white mug
7185,table indoor sitting food wooden coffee green small cake doughnut donut black plate
7186,clothing indoor bed blanket shirt small covered laying table holding colorful old blue phone sleeping plate
7187,indoor plastic food sitting table cake tray filled small plate holding black banana orange fruit clear laying white
7188,small sitting little child boy table food young girl baby holding man stuffed
7189,indoor bottle sitting table food orange glass filled white wine red mug holding laying phone
7190,cup indoor table sitting coffee red computer food keyboard desk black glass hot white mouse sandwich plate laying
7191,mirror small pair reflection food man white blue cat train riding
7192,indoor table sitting book old phone green
7193,indoor curtain building fabric table covered holding group standing white display window man
7194,
7195,
7196,orange sitting blue table black close clock laying ball room man phone city
7197,indoor bed laying book sitting cat shirt man
7198,table indoor sitting green food bottle coffee donut doughnut small wooden computer little cake plate birthday laptop eating sandwich
7199,indoor sitting table black close laying holding pair white board man remote plate blue
7200,indoor sitting bottle table cup food small can banana close glass phone laying cat coffee
7201,indoor sitting small black cat wooden brown man room table living holding standing laying computer white kitchen bed oven playing
7202,abstract blur
7203,book shelf indoor sitting table computer desk laptop front small room filled office keyboard black living library man bookshelf holding cat remote clock playing video
7204,
7205,indoor cabinet kitchen open food sitting black looking door oven steel stove stainless toaster close microwave refrigerator
7206,indoor black monitor sitting computer table screen white woman store desk standing
7207,
7208,person clothing man close black holding white
7209,indoor window table room sitting kitchen living counter mirror white view large glass light refrigerator sink standing
7210,
7211,indoor sitting red orange table food computer white counter apple light black bowl knife plate pizza kitchen
7212,indoor table desk sitting laptop computer wooden small room mirror cat keyboard mouse kitchen laying white living standing video
7213,indoor person sitting table computer laptop desk small wooden using phone keyboard mouse remote laying baby holding young people playing man
7214,bottle table sitting indoor food beer wine computer wooden laying soup
7215,indoor table person sitting food cellphone holding phone small wooden hand brown man cat laying white dog
7216,table wooden
7217,indoor table sitting book desk piece laying lying remote computer pair cake phone old control
7218,cup table small sitting silver white
7219,table white
7220,indoor bottle kitchen table refrigerator counter sink sitting food small open white microwave holding stove desk water standing man blender cat laying plate oven
7221,person indoor sitting holding small hand food black man laptop remote woman table cat laying white
7222,indoor person bottle holding hand small sitting black lotion remote control close food phone table desk keyboard man
7223,person thing object indoor man holding cellphone sitting hand phone table black lying laying remote white room living bed standing video
7224,person indoor table sitting using man hand pizza piece food young wooden laptop holding computer black cutting close shirt someone eating woman glass white phone restaurant red remote blue
7225,keyboard computer electronics sitting black laptop surface monitor close table laying white mouse
7226,indoor sitting cat bed black looking table window dog front room computer laptop standing laying bedroom living television woman man white
7227,book food
7228,indoor table food sitting cake book plate pizza red holding
7229,indoor table man sitting hat wearing cake holding birthday people woman phone group plate laying bed pizza
7230,standing street man white beach horse
7231,text
7232,indoor table cup sitting food coffee white desk room glass computer plate large cat donut laptop living milk wooden laying cake wine keyboard standing bed sink kitchen pizza man vase
7233,indoor sitting white small table computer open mouse phone laptop game red remote
7234,dog indoor small standing brown mirror black white kitchen rug sitting table room desk sink red group
7235,indoor sitting purple small little pink black standing bed girl table red man room stuffed laying playing luggage
7236,food table cup sitting bed small covered laying cat man white plate phone
7237,tattoo face man bird shirt cat street
7238,indoor table sitting wooden small floor pink standing board young woman red room white man plate
7239,car sitting table white cable small oven computer laptop desk old plate mouse cake laying phone stove standing
7240,person grass holding small toy girl stuffed teddy playing toddler brown little child sitting yellow wearing baby bear young pink hand frisbee woman laying man hat standing white purple ball
7241,indoor door sitting small room building floor open white mirror cat black kitchen sink bed refrigerator bedroom standing red laying
7242,indoor bottle table food counter sitting kitchen refrigerator filled glass white plate cat wine standing cake man computer sandwich room pizza sink coffee
7243,black dark standing front sitting white door cat screen large room bed laptop light man night computer table television flying woman red water kite field
7244,indoor table sitting looking cat large wooden clock holding bowl white room man standing
7245,indoor sitting floor building table small laying wooden cat large white bed dog water red man room
7246,red wearing fabric close closeup stop white bed
7247,indoor person baby sitting laying table holding bed small cellphone open lying phone man woman stuffed bear cat
7248,sitting bottle table wine counter front food sign pizza refrigerator laying kitchen old phone brick room standing parked street white plate meter
7249,floor indoor sitting food table small dog laying black holding orange eating kitchen cat pizza hot remote
7250,
7251,light white
7252,person holding hand small man phone black
7253,indoor food table cup sitting coffee doughnut donut banana dog filled fruit sandwich wooden hot hotdog yellow bun kitchen laptop computer plate laying pizza
7254,indoor table sitting red desk computer counter mouse black keyboard white vase standing
7255,indoor blue sitting table small laying lying pair white wooden computer standing desk cat red room man bed bag
7256,person indoor man hand holding black front table using computer screen laptop keyboard woman shirt young red white remote board standing room phone
7257,sitting chair table small close piece metal black food wooden surface silver laying blue white brown leather plate red purple room
7258,fence sitting bench black laying brown cat shoes woman standing white playing
7259,table phone
7260,indoor sitting table small white food kitchen room sink oven tiled plate man holding standing cat living stove
7261,indoor sitting table book food wooden laying phone bottle
7262,indoor sitting table black laying food brush laptop bed man computer remote white bottle cat
7263,person indoor food sitting table dog paper hot black plate holding fruit cheese sandwich bun eating man fries hotdog laying
7264,indoor table cup sitting green food counter filled white plate glass kitchen wooden holding sink vase room
7265,person indoor man sitting looking room laptop black wearing living table white glasses laying remote holding red standing cat light night blue
7266,indoor red room sitting table front living man bed wooden large woman laying white mirror standing holding playing phone
7267,indoor white refrigerator sitting hanging corner door mirror black sink kitchen large room shower standing red
7268,indoor sitting white room red bed people man blue
7269,text book cat laying
7270,indoor sitting table white holding black man pizza blue room
7271,flying white air plane airplane water black cloudy large holding sign man
7272,indoor building sitting small empty blue dirty sink wooden half brown white bowl tub room shower
7273,indoor sitting table computer mirror laptop close desk screen television man keyboard standing room blurry living cat pizza kitchen white
7274,electronics computer keyboard indoor sitting black laptop white table mouse desk board close wooden laying man
7275,outdoor snow grass tree small side covered path riding sheep bench hill water wooden large man park green standing field track river grazing street skiing group slope
7276,indoor sitting black stuffed looking close small brown laying head eyes bear cake bird food white
7277,person indoor bottle holding hand table small sitting toothbrush yellow man cut cake cutting water phone brush white remote plate standing
7278,sitting bench white glass curtain shower table large standing holding room bird rain man
7279,paper piece sitting table bag food eaten pizza pair laying bed
7280,indoor table sitting laptop living room computer television black desk glass white rug red phone cat
7281,person indoor man holding woman looking white smiling wearing young sitting black using girl head cutting cut mouth laying bed teeth
7282,indoor table computer sitting monitor desk laptop screen keyboard black white television light man large mouse desktop laying cat standing room bed
7283,table front food woman holding man clock white kitchen
7284,indoor cup sitting toothbrush teeth holding woman food brushing phone brush table
